{
  "$schema": "https://file-1257193553.cos.ap-shanghai.myqcloud.com/GenshinAlert/GAH_schema_v1.3.2.json",
  "RUN_ENV": "local",
  "UID": "",
  "COOKIE": "",
  "NAME": "",

  "RESIN_ALERT_NUM": 140,
  "RECEIVE_RESIN_DATA": "ON",
  "RECEIVE_BOSS_COUNT": "ON",
  "RECEIVE_TASK_NUM": "ON",
  "RECEIVE_HOMECOIN_ALERT":"ON",
  "REVEIVE_EXPEDITION_NUM": "ON",
  "INCOMPLETE_ALERT": "213030",
  "EXPEDITION_COMPLETE_ALERT": "ON",
  "SLEEP_TIME": 900,
  "ALERT_SUCCESS_SLEEP_TIME": 1800,
  "SLEEP_START_TIME": "",
  "SLEEP_END_TIME": "",

  "WW_ID": "",
  "WW_APP_SECRET": "",
  "WW_APP_USERID": "",
  "WW_APP_AGENTID": "",
  "WW_BOT_KEY": "",
  "BARK_URL": "https://api.day.app/",
  "BARK_KEY": "",
  "BARK_GROUP": "",
  "BARK_ICON": "https://ae03.alicdn.com/kf/Hca199ca287ee4ee8aa4c8004db6de367o.png",
  "BARK_ARCHIVE": "",
  "BARK_LEVEL": "",
  "TG_BOT_API": "api.telegram.org",
  "TG_BOT_TOKEN": "",
  "TG_USER_ID": "",
  "PUSHDEER_KEY":"",
  "CQHTTP_URL": "",
  "CQHTTP_MESSAGE_TYPE": "private",
  "CQHTTP_SEND_ID": "",
  "CQHTTP_TOKEN": "",
  "DD_BOT_TOKEN": "",
  "DD_BOT_SECRET": "",
  "SCTKEY": "",
  "PUSH_PLUS_TOKEN": "",
  "PUSH_PLUS_USER": "",
  "COOL_PUSH_SKEY": "",
  "COOL_PUSH_MODE": "psend",
  "COOL_PUSH_SENDID": "",
  "QMSG_KEY": "",
  "DISCORD_WEBHOOK": "",
  "IGOT_KEY": ""
}